{
  "contract": "reference_marketing_script_request_v2",
  "corpus_id": "instagram-personalbrandlaunch-reference-v1",
  "title": "Automate the Bottleneck, Not the Demo",
  "topic": "How a software founder should choose the first workflow to automate",
  "audience": "software founders deciding where AI automation can create useful business value",
  "objective": "educate",
  "content_role": "EDUCATE",
  "topic_distance_from_offer": 2,
  "angle": "contrast",
  "target_seconds": 60,
  "narrative": {
    "hook": "The best AI automation is usually the least impressive demo and the easiest line item to measure",
    "problem": "Teams often automate the task that looks futuristic while the real bottleneck still makes people wait every single day",
    "stakes": "That creates more software to supervise without removing enough cost, delay, or repeated mistakes",
    "reframe": "So rank the workflow before you build it",
    "steps": [
      "count how often the task happens",
      "measure how long a person or customer waits for it",
      "decide whether the output can be checked from a receipt instead of someone's opinion"
    ],
    "proof": {
      "statement": "a lead handoff lets you measure the incoming lead, the response time, the routing decision, and whether the meeting was booked",
      "evidence_type": "worked_example",
      "source_receipt_ids": []
    },
    "takeaway": "If a workflow is frequent, slow, and easy to verify, it is a strong automation candidate. If one of those is missing, keep looking",
    "cta": {
      "text": "Start with one repeated task today and score it on frequency, waiting time, and proof",
      "action": "score one task",
      "destination": ""
    }
  },
  "offer": {
    "offer_id": "",
    "name": ""
  }
}
